<?xml version="1.0" encoding="UTF-8"?>
<dfi:DFIReturn xmlns:dfi="urn:cbn:dfi:reporting:v1"
               xmlns:xsi="http://www.w3.org/2001/XMLSchema-instance"
               xsi:schemaLocation="urn:cbn:dfi:reporting:v1 DFI_Return_Schema_v1.0.xsd"
               schemaVersion="1.0">

  <dfi:Header>
    <dfi:DFILicenceNo>DFI/2001/00003</dfi:DFILicenceNo>
    <dfi:DFIName>Sample Development Bank of Nigeria</dfi:DFIName>
    <dfi:ReturnType>LPQ</dfi:ReturnType>
    <dfi:DFIMandate>Industrial</dfi:DFIMandate>
    <dfi:ReportingPeriodStart>2026-01-01</dfi:ReportingPeriodStart>
    <dfi:ReportingPeriodEnd>2026-03-31</dfi:ReportingPeriodEnd>
    <dfi:SubmissionDateTime>2026-04-25T09:00:00Z</dfi:SubmissionDateTime>
    <dfi:ContactPerson>Ibrahim Musa</dfi:ContactPerson>
    <dfi:ContactEmail>regulatory@sampledevbank.com.ng</dfi:ContactEmail>
  </dfi:Header>

  <dfi:LoanPortfolio>
    <dfi:SectorAllocation>
      <dfi:SectorName>Manufacturing / Industrial</dfi:SectorName>
      <dfi:NumberOfLoans>245</dfi:NumberOfLoans>
      <dfi:OutstandingBalance>185.50</dfi:OutstandingBalance>
      <dfi:PctOfPortfolio>32.15</dfi:PctOfPortfolio>
      <dfi:DisbursedQuarter>28.00</dfi:DisbursedQuarter>
      <dfi:RepaidQuarter>12.50</dfi:RepaidQuarter>
    </dfi:SectorAllocation>
    <dfi:SectorAllocation>
      <dfi:SectorName>Agriculture / Agro-Processing</dfi:SectorName>
      <dfi:NumberOfLoans>1820</dfi:NumberOfLoans>
      <dfi:OutstandingBalance>95.20</dfi:OutstandingBalance>
      <dfi:PctOfPortfolio>16.50</dfi:PctOfPortfolio>
      <dfi:DisbursedQuarter>15.00</dfi:DisbursedQuarter>
      <dfi:RepaidQuarter>8.30</dfi:RepaidQuarter>
    </dfi:SectorAllocation>
    <dfi:SectorAllocation>
      <dfi:SectorName>MSMEs - Small</dfi:SectorName>
      <dfi:NumberOfLoans>12500</dfi:NumberOfLoans>
      <dfi:OutstandingBalance>120.80</dfi:OutstandingBalance>
      <dfi:PctOfPortfolio>20.93</dfi:PctOfPortfolio>
      <dfi:DisbursedQuarter>22.00</dfi:DisbursedQuarter>
      <dfi:RepaidQuarter>18.50</dfi:RepaidQuarter>
    </dfi:SectorAllocation>
    <dfi:SectorAllocation>
      <dfi:SectorName>Infrastructure - Power / Energy</dfi:SectorName>
      <dfi:NumberOfLoans>18</dfi:NumberOfLoans>
      <dfi:OutstandingBalance>85.00</dfi:OutstandingBalance>
      <dfi:PctOfPortfolio>14.73</dfi:PctOfPortfolio>
      <dfi:DisbursedQuarter>10.00</dfi:DisbursedQuarter>
      <dfi:RepaidQuarter>3.20</dfi:RepaidQuarter>
    </dfi:SectorAllocation>
    <dfi:SectorAllocation>
      <dfi:SectorName>Export Finance / Trade</dfi:SectorName>
      <dfi:NumberOfLoans>85</dfi:NumberOfLoans>
      <dfi:OutstandingBalance>90.50</dfi:OutstandingBalance>
      <dfi:PctOfPortfolio>15.69</dfi:PctOfPortfolio>
      <dfi:DisbursedQuarter>18.00</dfi:DisbursedQuarter>
      <dfi:RepaidQuarter>14.00</dfi:RepaidQuarter>
    </dfi:SectorAllocation>

    <dfi:TotalLoanPortfolio>577.00</dfi:TotalLoanPortfolio>
    <dfi:TotalDisbursements>93.00</dfi:TotalDisbursements>
    <dfi:TotalRepayments>56.50</dfi:TotalRepayments>
    <dfi:RepaymentRate>95.80</dfi:RepaymentRate>
    <dfi:AvgLoanTenorMonths>48</dfi:AvgLoanTenorMonths>
    <dfi:WeightedAvgRate>12.50</dfi:WeightedAvgRate>
    <dfi:OnLending>
      <dfi:TotalPFIs>42</dfi:TotalPFIs>
      <dfi:AmountOnLent>125.00</dfi:AmountOnLent>
      <dfi:EndBorrowersReached>48500</dfi:EndBorrowersReached>
    </dfi:OnLending>
  </dfi:LoanPortfolio>

  <dfi:DevelopmentImpact>
    <dfi:DirectJobsCreated>8500</dfi:DirectJobsCreated>
    <dfi:JobsSustained>42000</dfi:JobsSustained>
    <dfi:MSMEsFinanced>14668</dfi:MSMEsFinanced>
    <dfi:WomenOwnedMSMEs>4250</dfi:WomenOwnedMSMEs>
    <dfi:YouthOwnedMSMEs>5800</dfi:YouthOwnedMSMEs>
    <dfi:ExportRevenueFacilitated>45.00</dfi:ExportRevenueFacilitated>
    <dfi:GreenClimateFinance>12.50</dfi:GreenClimateFinance>
    <dfi:RuralLendingPct>35.00</dfi:RuralLendingPct>
  </dfi:DevelopmentImpact>

  <dfi:Signature>
    <dfi:PreparedBy>
      <dfi:Name>Ngozi Okafor</dfi:Name>
      <dfi:Designation>Head, Regulatory Reporting &amp; Compliance</dfi:Designation>
      <dfi:Date>2026-04-22</dfi:Date>
    </dfi:PreparedBy>
    <dfi:MDSignOff>
      <dfi:Name>Aliyu Abdullahi</dfi:Name>
      <dfi:Designation>Managing Director / CEO</dfi:Designation>
      <dfi:Date>2026-04-25</dfi:Date>
    </dfi:MDSignOff>
    <dfi:CertificationStatement>I/We certify that the information provided is true, accurate, and complete to the best of our knowledge and in compliance with CBN Prudential Standards for Development Finance Institutions.</dfi:CertificationStatement>
  </dfi:Signature>

</dfi:DFIReturn>
